{
  "name": "handoff-tool",
  "provides": ["tools"],
  "loadOrder": 10,
  "description": "Plan-execute handoff tool — allows the agent to clear context and restart with a prepared plan",
  "configSchema": {
    "handoffTool": {
      "type": "object",
      "properties": {
        "enabled": {
          "type": "boolean",
          "default": true,
          "description": "Whether this extension is enabled. Set to false to disable the extension entirely."
        },
        "autoIncludeFilesUnderBytes": {
          "type": "integer",
          "minimum": 0,
          "default": 24576,
          "description": "Files in the handoff files list that exist and are this size or smaller (in bytes) are inlined into the handoff message automatically; larger and missing files are listed with their size. Default 24KB. Set to 0 to list files without inlining any."
        }
      },
      "additionalProperties": false,
      "layers": [
        { "source": "config", "key": "handoffTool" },
        { "default": {} }
      ]
    }
  }
}
