{
  "name": "ui-info-cli",
  "provides": ["cli:subcommands"],
  "loadOrder": 10,
  "description": "Provides info and show-prompt CLI subcommands, plus the /show-prompt interactive slash command",
  "configSchema": {
    "uiInfoCli": {
      "type": "object",
      "properties": {
        "enabled": {
          "type": "boolean",
          "default": true,
          "description": "Whether this extension is enabled. Set to false to disable the extension entirely."
        }
      },
      "additionalProperties": false,
      "layers": [{ "source": "config", "key": "uiInfoCli" }, { "default": {} }]
    }
  },
  "cli:flags": [
    {
      "long": "--config-debug",
      "type": "boolean",
      "description": "Show config resolution details (info subcommand)"
    }
  ],
  "cli:subcommands": [
    {
      "name": "info",
      "description": "Show system info and diagnostics",
      "options": [
        {
          "name": "--config-debug",
          "type": "boolean",
          "description": "Show config resolution details (sources and layers)"
        }
      ]
    },
    {
      "name": "show-prompt",
      "description": "Show rendered system prompt with tool definitions"
    },
    {
      "name": "profiles",
      "description": "List all available profiles with their tool restrictions"
    }
  ]
}
