{
  "name": "websocket",
  "provides": [],
  "loadOrder": 10,
  "dependsOn": ["file-attachment"],
  "description": "WebSocket server for agent session management — provides core backend utility for UI extensions",
  "autoload": true,
  "configSchema": {
    "websocket": {
      "type": "object",
      "properties": {
        "enabled": {
          "type": "boolean",
          "default": true,
          "description": "Whether this extension is enabled. Set to false to disable the extension entirely."
        },
        "sessionTimeoutMin": {
          "type": "number",
          "default": 30,
          "description": "Idle session cleanup timeout (minutes)"
        },
        "questionTimeoutSecs": {
          "type": "number",
          "default": 300,
          "description": "Default question timeout (seconds)"
        },
        "questionStrategy": {
          "type": "string",
          "default": "wait",
          "enum": ["wait", "default", "cancel"],
          "description": "Default question strategy"
        }
      },
      "additionalProperties": false,
      "layers": [
        { "source": "config", "key": "websocket" },
        { "default": {} }
      ]
    }
  }
}
