{
  "name": "fetch-tool",
  "provides": ["tools"],
  "loadOrder": 1,
  "description": "Make HTTP requests via the fetch tool",
  "configSchema": {
    "fetchTool": {
      "type": "object",
      "properties": {
        "enabled": {
          "type": "boolean",
          "default": true,
          "description": "Whether this extension is enabled. Set to false to disable the extension entirely."
        },
        "maxBodyLength": {
          "type": "number",
          "default": 20000,
          "description": "Maximum number of characters to return before truncating responses."
        },
        "maxImageSize": {
          "type": "number",
          "default": 10485760,
          "description": "Maximum image response size in bytes returned as an attachment. Larger images are rejected outright."
        },
        "fetchTimeoutMs": {
          "type": "number",
          "default": 30000,
          "description": "Timeout in milliseconds for requests (headers and body). Slow or dead hosts abort instead of hanging the agent."
        },
        "allowedSchemes": {
          "type": "array",
          "items": { "type": "string" },
          "default": ["http", "https"],
          "description": "URL schemes the fetch tool may use. Defaults to http/https, which blocks file:// (local file reads) and other schemes."
        },
        "allowPrivateHosts": {
          "type": "boolean",
          "default": false,
          "description": "Allow fetching hosts that are, or resolve to, private/reserved addresses (localhost, RFC1918, link-local/metadata, ULA, CGNAT). Default false blocks SSRF against local/cloud-internal services. Env HOTDOG_FETCH_ALLOW_PRIVATE_HOSTS (truthy/falsy) overrides the config file.",
          "layers": [
            { "source": "env", "key": "HOTDOG_FETCH_ALLOW_PRIVATE_HOSTS", "cast": "truthy" },
            { "source": "config", "key": "fetchTool.allowPrivateHosts" },
            { "default": false }
          ]
        }
      },
      "additionalProperties": false,
      "layers": [{ "source": "config", "key": "fetchTool" }, { "default": {} }]
    }
  }
}
